,base,authors_l,title_l,title,journal_l,keywords_l,year,language,doi
226,lisa,"paula wivianne quirino dos santos, joao pedro silva de albuquerque",altmetria uma nova lente para os estudos metricos da informacao,ALTMETRIA: UMA NOVA LENTE PARA OS ESTUDOS MÉTRICOS DA INFORMAÇÃO,biblionline,"informetrics , bibliometrics",2017,Portuguese,
228,lisa,"samantha mcclellan, robert detmering, george martinez, anna marie johnson",raising the librarys impact factor a case study in scholarly publishing literacy for graduate students,Raising the Library's Impact Factor: A Case Study in Scholarly Publishing Literacy for Graduate Students,portal,"user training , collaboration , information literacy , academic libraries , graduate studies , librarians , scholarly publishing , scholarly communication , case studies , libraries , literacy , collaboration , college students , higher education",2017,English,10.1353/pla.2017.0034
229,lisa,"zhichao fang, xinhui guo, yang yang, zhongkai yang, qingchun li, zhigang hu, xianwen wang",measuring global research activities using geographic data of scholarly article visits,Measuring global research activities using geographic data of scholarly article visits,the electronic library,"outliers (statistics) , journals , data processing , scientific papers , resource allocation , websites , citation analysis , researchers , metropolitan areas , scholarly publishing , hail , scientometrics , bibliometrics , players , social networks , repositories , informetrics , developing countries--ldcs , open access , geography , geographical distribution , developing countries--ldcs , united states--us , china",2017,English,10.1108/el-10-2016-0228
231,lisa,"alejandro uribe-tirado, joel alhuay-quispe",estudio metrico de alfin en iberoamerica de la bibliometria a las altmetrics,Estudio métrico de ALFIN en Iberoamérica: de la bibliometría a las altmetrics,revista espanola de documentacion cientifica,"user training , scientometrics , bibliometrics , information literacy , social networks , scientific papers , indicators , visibility , impact analysis , productivity , platforms , informetrics , search engines , social research , latin america",2017,Spanish,10.3989/redc.2017.3.1414
232,lisa,"nicole muscanell, sonja utz",social networking for scientists an analysis on how and why academics use researchgate,Social networking for scientists: an analysis on how and why academics use ResearchGate,online information review,"scientists , polls & surveys , social networks , user behavior , social networks , productivity , digital media , social research , scientists , social network analysis",2017,English,10.1108/oir-07-2016-0185
233,lisa,"maryam sarrafzadeh, narges khaleghi",instruction of citation management tools by academic librarians the need for training the trainers,Instruction of Citation Management Tools by Academic Librarians: The Need for Training the Trainers,webology,"librarians , web sites , citation management software , professional development , academic libraries , iran",2017,English,
234,lisa,jody condit fagan,an evidence based review of academic web search engines 2014 2016 implications for librarians practice and research agenda,"An Evidence-Based Review of Academic Web Search Engines, 2014-2016: Implications for Librarians' Practice and Research Agenda",information technology and libraries online,"librarians , search engines , arts , science , libraries , search engines , studies , fitness , scientific papers , documents , books",2017,English,10.6017/ital.v36i2.9718
235,lisa,raj kumar bhardwaj,academic social networking sites,Academic social networking sites,information and learning science,"college students , social networks , researchers , higher education , libraries , information science",2017,English,10.1108/ils-03-2017-0012
236,lisa,maria nelida gonzalez de gomez,a analises das citacoes precisa de uma teoria ou da filosofia da ciencia,A análises das citações precisa de uma teoria ou da filosofia da ciência?,informacao sociedade,"citation analysis , epistemology",2017,Portuguese,
237,lisa,"maria claudia cabrini gracio, ely francina tannuri de oliveira",a pesquisa brasileira em estudos metricos da informacao proximidade entre pesquisadores de destaque e areas afins,A pesquisa brasileira em Estudos Métricos da Informação: proximidade entre pesquisadores de destaque e áreas afins,informacao sociedade,"researchers , bibliometrics , brazil",2017,Portuguese,
238,lisa,"lynsey taylor, peter willett",comparison of us and uk rankings of lis journals,Comparison of US and UK rankings of LIS journals,aslib journal of information management,"promotion , libraries , documentation , assessments , scientometrics , bibliometrics , journals , academic libraries , trends , open access publishing , library and information science , citation analysis , ratings & rankings , informetrics , collection management , quality , information management , united states--us , united kingdom--uk",2017,English,10.1108/ajim-08-2016-0136
240,lisa,paul ojennus,open access and the humanities,Open Access and the Humanities,library resources technical services,"journals , science , academic libraries , open access publishing , humanities , scholarly publishing , scholarly communication , end users , perceptions",2017,English,
242,lisa,"dyuti samanta, bidyarthi dutta",altmetrics six years of changing scholarly appraisal,Altmetrics: Six Years of Changing Scholarly Appraisal,srels journal of information management,"social networks , web 2.0 , scientometrics , informetrics , social research",2017,English,
243,lisa,"paola bongiovani, sandra miguel, tony hernandez-perez",actitudes y percepciones de los evaluadores de la carrera cientifica en argentina sobre la publicacion en acceso abierto,Actitudes y percepciones de los evaluadores de la carrera científica en Argentina sobre la publicación en acceso abierto,revista espanola de documentacion cientifica,"research , journals , bibliometrics , professional development , documents , open access publishing , researchers , scholarly publishing , argentina",2017,Spanish,10.3989/redc.2017.2.1404
244,lisa,"muhammad yousuf ali, joanna richardson",pakistani lis scholars altmetrics in researchgate,Pakistani LIS scholars' altmetrics in ResearchGate,program,"libraries , demographics , academic libraries , cooperation , scientific papers , scholars , electronic documents , correlation analysis , information dissemination , publication output , bibliometrics , library and information science , pakistan",2017,English,10.1108/prog-07-2016-0052
245,lisa,"lin he, zhengbiao han",do usage counts of scientific data make sense an investigation of the dryad repository,Do usage counts of scientific data make sense? An investigation of the Dryad repository,library hi tech,"research methodology , scientometrics , datasets , bibliometrics , citation indexes , information sharing , funding , publications , social networks , researchers , academic publications , informetrics , qualitative research , reliability analysis , digital data , citation analysis , repositories",2017,English,10.1108/lht-12-2016-0158
246,lisa,david stuart,data bibliometrics metrics before norms,Data bibliometrics: metrics before norms,online information review,"open data , scientometrics , journals , bibliometrics , citation indexes , information sharing , open access publishing , citation analysis , neurosciences , co authorship , scholarly publishing , scholarly communication , digital curation , norms , bibliometrics",2017,English,10.1108/oir-01-2017-0008
247,lisa,"jin-cheon na, yingxin estella ye",content analysis of scholarly discussions of psychological academic articles on facebook,Content analysis of scholarly discussions of psychological academic articles on Facebook,online information review,"scientometrics , journals , bibliometrics , audiences , publications , publishing , social networks , content analysis , scholars , researchers , informetrics , social research , scientific papers , content analysis , promotion , qualitative analysis , documents",2017,English,10.1108/oir-02-2016-0058
248,lisa,ann e williams,altmetrics an overview and evaluation,Altmetrics: an overview and evaluation,online information review,"citations , scientometrics , bibliometrics , scholars , researchers , impact factors , academic publications , informetrics , research & development--r&d",2017,English,10.1108/oir-10-2016-0294
249,lisa,"kim mlis mears, sandra l ms bandy",investigating the need for scholarly communications positions in association of academic health sciences libraries member institutions,Investigating the need for scholarly communications positions in Association of Academic Health Sciences Libraries member institutions,journal of the medical library association,"medical libraries , librarians , scholarly communication",2017,English,10.5195/jmla.2017.208
250,lisa,"marlee givens, lisa a macklin, paolo mangiafico",faculty profile systems new services and roles for libraries,Faculty Profile Systems: New Services and Roles for Libraries,portal,"scholars , students , academic libraries , librarians , scholarly publishing , research methodology , learning , studies , ecosystems , bibliographic data bases , biomedical engineering , researchers , informetrics , institutional repositories , interdisciplinary aspects , open access , scholarly communication , user training , libraries , haiti",2017,English,10.1353/pla.2017.0014
251,lisa,"devin savage, pattie piotrowski, lisa massengale",academic librarians engage with assessment methods and tools,Academic Librarians Engage with Assessment Methods and Tools,portal,"academic libraries , librarians , higher education , research , library collections , learning , success , studies , collaboration , verbal communication , information literacy , special collections , user training , libraries , chicago illinois , illinois",2017,English,10.1353/pla.2017.0025
252,lisa,juan gorraiz,los mil y un reflejos de las publicaciones en el laberinto de espejos de las nuevas metricas,LOS MIL Y UN REFLEJOS DE LAS PUBLICACIONES EN EL LABERINTO DE ESPEJOS DE LAS NUEVAS MÉTRICAS,el profesional de la informacion,"social networks , scientometrics",2017,English,
253,lisa,"michael j kurtz, edwin a henneken",measuring metrics a 40 year longitudinal cross validation of citations downloads and peer review in astrophysics,"Measuring metrics - a 40-year longitudinal cross-validation of citations, downloads, and peer review in astrophysics",journal of the association for information science and technology,"astronomy, astrophysics, astrophysics, citation analysis, citation analysis, downloading, neighborhood, peer review, quantitative psychology, scholarly publishing, validation studies",2017,English,10.1002/asi.23689
254,lisa,mike thelwall,are mendeley reader counts high enough for research evaluations when articles are published,Are Mendeley reader counts high enough for research evaluations when articles are published?,aslib journal of information management,"citations , scientometrics , collaboration , journals , publications , scientific papers , documents , library and information science , citation analysis , impact factors , libraries , informetrics , readers , information management",2017,English,10.1108/ajim-01-2017-0028
255,lisa,"terttu kortelainen, mari katvala, anni-siiri lansman",attention and altmetrics,Attention and altmetrics,information research,"social networks , radio stations , informetrics",2017,English,
256,lisa,"valerie spezi, simon wakeling, stephen pinfield, claire creaser, jenny fry, peter willett",open access mega journals,Open-access mega-journals,journal of documentation,"journals , journals , science , scale (ratio) , debates , open access publishing , social networks , business , economic analysis , economic models , scholarly publishing , ethical standards , scholarly communication , quality , literature reviews , united kingdom--uk",2017,English,10.1108/jd-06-2016-0082
257,lisa,omwoyo bosire onyancha,altmetrics of south african journals implications for scholarly impact of south african research,Altmetrics of South African Journals: Implications for Scholarly Impact of South African Research,publishing research quarterly,"bibliometrics , journals , social network analysis , secondary education , journals (academic) , higher education , south africa",2017,English,10.1007/s12109-016-9485-0
258,lisa,"aceil al-khatib, jaime a da silva, teixeira",threats to the survival of the author pays journal to publish model,Threats to the Survival of the Author-Pays-Journal to Publish Model,publishing research quarterly,"writers , peer review , credibility , publishing industry , fees & charges , open access , journals (academic) , physicians , credibility , education policy , patients , verbal aggression , united states--us , japan",2017,English,10.1007/s12109-016-9486-z
260,lisa,"tint hla hla htoo, jin-cheon na",disciplinary differences in altmetrics for social sciences,Disciplinary differences in altmetrics for social sciences,online information review,"studies , social networks , clinical psychology , research , humanities , life sciences , social sciences , political science , validity , citations , informetrics , indicators , citation analysis , business law , correlation analysis , singapore",2017,English,10.1108/oir-12-2015-0386
261,lisa,"raimunda ribeiro, lidia oliveira, cassia furtado",internacionalizacao e visibilidade da comunidade cientifica da area de biblioteconomia e ciencia da informacao brasil e portugal analise da dialetica entre formacao continua e comportamento infocomunicacional,INTERNACIONALIZAÇÃO E VISIBILIDADE DA COMUNIDADE CIENTÍFICA DA ÁREA DE BIBLIOTECONOMIA E CIÊNCIA DA INFORMAÇÃO (BRASIL E PORTUGAL): análise da dialética entre formação contínua e comportamento infocomunicacional,paginas a b,"researchers , behavior , teachers , information science , higher education , continuing education , portugal , brazil",2017,Portuguese,
262,lisa,"mindy thuna, pam king",research impact metrics a faculty perspective,Research Impact Metrics: A Faculty Perspective,partnership,"research , citations , productivity , bibliometrics , academic libraries , product information , researchers , librarians , impact factors , informetrics , interviews , hirsch index , scholarly communication , college faculty",2017,English,10.21083/partnership.v12i1.3906
263,lisa,"leslie adriaanse, chris rensleigh",e visibility of environmental science researchers at the university of south africa,E-visibility of environmental science researchers at the University of South Africa,south african journal of library and information science suid afrikaanse tydskrif vir biblioteek en inligtingkunde,"researchers , bibliometrics , digital archives , environmental science , social research , publication output , south africa",2017,English,
264,lisa,"paulo roberto cintra, ariadne chloe furnival, douglas henrique milanez",vantagens de citacao do acesso aberto em periodicos selecionados da ciencia da informacao uma analise ampliada aos indicadores altmetricos,VANTAGENS DE CITAÇÃO DO ACESSO ABERTO EM PERIÓDICOS SELECIONADOS DA CIÊNCIA DA INFORMAÇÃO: UMA ANÁLISE AMPLIADA AOS INDICADORES ALTMÉTRICOS,informacao informacao,"copyright , citations , scientometrics , journals , bibliometrics , informetrics , information science , open access , licensing",2017,Portuguese,
265,lisa,"daniel torres-salinas, nicolas robinson-garcia, juan gorraiz",filling the citation gap measuring the multidimensional impact of the academic book at institutional level with plumx,Filling the citation gap: measuring the multidimensional impact of the academic book at institutional level with PlumX,scientometrics,"indicators , indicators , impact analysis , monographs , libraries , bibliometrics , informetrics , books , books , complementarity , books , citations , colleges & universities",2017,English,10.1007/s11192-017-2539-z
266,lisa,"saeed-ul hassan, mubashir imran, uzair gillani, naif radi aljohani, timothy d bowman, fereshteh didegah",measuring social media activity of scientific literature an exhaustive comparison of scopus and novel altmetrics big data,Measuring social media activity of scientific literature: an exhaustive comparison of scopus and novel altmetrics big data,scientometrics,"databases , data management , data processing , astronomy , social networks , physics , astronomy , documents , social networks , citation analysis , data bases , informetrics , nursing , digital media , citation analysis , databases",2017,English,10.1007/s11192-017-2512-x
267,lisa,sasekea harris,2016 top trends and issues in jamaican academic libraries,2016 top trends and issues in Jamaican academic libraries,information and learning science,"user services , higher education , academic libraries , trends , chief librarians , integrated library systems-ils , open access publishing , library collections , access to information , internet resources , information technology , scholarly communication , access to materials , jamaica",2017,English,10.1108/ils-10-2016-0069
268,lisa,"aida pooladian, angel borrego",methodological issues in measuring citations in wikipedia a case study in library and information science,Methodological issues in measuring citations in Wikipedia: a case study in Library and Information Science,scientometrics,"library and information science , standardization , libraries , case studies , citations , standardization , open access , case studies",2017,English,10.1007/s11192-017-2474-z
269,lisa,"joaquin chapa, zeeshan haq, adam s cifu",comparative analysis of the factors associated with citation and media coverage of clinical research,Comparative analysis of the factors associated with citation and media coverage of clinical research,scientometrics,"clinical trials , medical services , hepatitis c virus , journals , hepatitis , medical research , hepatitis c , media , social networks , news , citation analysis , hepatitis , informetrics , population number , funding , digital media , media coverage , clinical trials , citation analysis , comparative analysis , comparative analysis",2017,English,10.1007/s11192-017-2428-5
270,lisa,jaime a. teixeira da silva,does china need to rethink its metrics and citation based research rewards policies,Does China need to rethink its metrics- and citation-based research rewards policies?,scientometrics,"markets , scientometrics , scholarly publishing , upgrading , digital media , policies , scientists , china",2017,English,10.1007/s11192-017-2430-y
271,lisa,"fernanda peset mancebo, rafael aleixandre-benavent, yolanda blasco-gil, antonia ferrer-sapena",datos abiertos de investigacion camino recorrido y cuestiones pendientes,DATOS ABIERTOS DE INVESTIGACIÓN. CAMINO RECORRIDO Y CUESTIONES PENDIENTES,anales de documentacion,"open data , research data management , research , data collection",2017,Spanish,10.6018/analesdoc.20.1.272101
272,lisa,"mike thelwall, kayvan kousha",researchgate versus google scholar which finds more early citations,ResearchGate versus Google Scholar: Which finds more early citations?,scientometrics,"library and information science , citation analysis , libraries , journals , scientific papers , citation analysis , journals , citation indexes",2017,English,10.1007/s11192-017-2400-4
273,lisa,"enrique orduna-malea, alberto martin-martin, mike thelwall, emilio delgado lopez-cozar",do researchgate scores create ghost academic reputations,Do ResearchGate Scores create ghost academic reputations?,scientometrics,"social networks , promotion , recruitment , recruitment , researchers , social organization , social networks , physics , documents , bibliometrics",2017,English,10.1007/s11192-017-2396-9
274,lisa,"julia vainio, kim holmberg",highly tweeted science articles who tweets them an analysis of twitter user profile descriptions,Highly tweeted science articles: who tweets them? An analysis of Twitter user profile descriptions,scientometrics,"social sciences , qualitative analysis , engineering , descriptions , classification , health , agricultural engineering , scientific papers , agronomy , content analysis , social networks , social behavior , user profiles , bibliometrics , content analysis , agricultural engineering",2017,English,10.1007/s11192-017-2368-0
275,lisa,"joao de melo maricato, ethamillya lyanna moura lima",impactos da altmetria aspectos observados com analises de perfis no facebook e twitter,Impactos da Altmetria: aspectos observados com análises de perfis no Facebook e Twitter,informacao sociedade,"social networks , informetrics , libraries , social network analysis",2017,Portuguese,
276,lisa,"kyrille goldbeck debose, inga haugen, rebecca k miller",information literacy instruction programs supporting the college of agriculture and life sciences community at virginia tech,Information Literacy Instruction Programs: Supporting the College of Agriculture and Life Sciences Community at Virginia Tech,library trends,"librarians , college campuses , skills , skill development , academic libraries , agriculture , life sciences , departments , community , graduate students , information literacy , scholarly communication , user training , ethics , literacy , agriculture , college students , audience , academic discourse , virginia",2017,English,10.1353/lib.2017.0004
277,lisa,"aida pooladian, angel borrego",twenty years of readership of library and information science literature under mendeleys microscope,Twenty years of readership of library and information science literature under Mendeley's microscope,performance measurement and metrics,"social networks , scholars , academic libraries , librarians , library collections , science , social research , studies , social sciences , publications , citation analysis , management decisions , researchers , journals , citation management software , collection management , information seeking behavior , informetrics , library and information science , publication output , scholarly communication , use statistics , libraries , citation analysis , postgraduate , information management , software , spain",2017,English,
278,lisa,jane cho,a comparative study of the impact of korean research articles in four academic fields using altmetrics,A comparative study of the impact of Korean research articles in four academic fields using altmetrics,performance measurement and metrics,"social networks , studies , research , academic libraries , science , society , humanities , social sciences , bibliometrics , funding , researchers , citation indexes , informetrics , open access , scholarly communication , journals , medical research , social networks , bibliometrics , comparative studies , medical science , impact analysis , arts , digital media , correlation analysis , research & development--r&d , blogs , pittsburgh pennsylvania",2017,English,10.1108/pmm-02-2016-0005
279,lisa,"rishabh shrivastava, preeti mahajan",an altmetric analysis of researchgate profiles of physics researchers,An altmetric analysis of ResearchGate profiles of physics researchers,performance measurement and metrics,"studies , social networks , academic libraries , scholarly publishing , social research , publications , bibliometrics , scholars , researchers , informetrics , institutional repositories , scholarly communication , web 2.0 , followers , correlation , documents , astrophysics , developing nations , india",2017,English,10.1108/pmm-07-2016-0033
281,lisa,"rongying zhao, mingkun wei",impact evaluation of open source software an altmetrics perspective,Impact evaluation of open source software: an Altmetrics perspective,scientometrics,"position measurement , data processing , web 2.0 , computer programs , community relations , open source software , software , on-line systems , indicators , free flow , multiplexing , informetrics , impact prediction , evaluation , software , internet , freeware , citation analysis , researchers",2017,English,10.1007/s11192-016-2204-y
282,lisa,"lutz bornmann, robin haunschild",does evaluative scientometrics lose its main focus on scientific quality by the new orientation towards societal impact,Does evaluative scientometrics lose its main focus on scientific quality by the new orientation towards societal impact?,scientometrics,"taxonomy , scientometrics , taxonomy , vocabularies & taxonomies",2017,English,10.1007/s11192-016-2200-2
283,lisa,"antonio fernandez-cano, ines m fernandez-guerrero",a multivariate model for evaluating emergency medicine journals,A multivariate model for evaluating emergency medicine journals,scientometrics,"reliability analysis , emergency medical care , well construction , emergency medical services , journals , scientific papers , multivariate analysis , indicators , indicators , citation analysis , multivariate analysis , mathematical models , clusters , statistical analysis , bivariate analysis , evaluation , medicine , multivariate analysis , multivariate analysis , citation analysis , clustering , hirsch index",2017,English,10.1007/s11192-016-2197-6
284,lisa,"robin haunschild, lutz bornmann",how many scientific papers are mentioned in policy related documents an empirical investigation using web of science and altmetric data,How many scientific papers are mentioned in policy-related documents? An empirical investigation using Web of Science and Altmetric data,scientometrics,"scientometrics , empirical analysis , informetrics , categories , scientific papers , documents , academic publications",2017,English,10.1007/s11192-016-2237-2
285,lisa,houqiang yu,context of altmetrics data matters an investigation of count type and user category,Context of altmetrics data matters: an investigation of count type and user category,scientometrics,"impact analysis , statistical analysis , informetrics , categories , statistical tests , social networks , citation analysis",2017,English,10.1007/s11192-017-2251-z
