,base,authors_l,title_l,title,journal_l,keywords_l,year,language,doi
286,lisa,"brett buttliere, jurgen buder",personalizing papers using altmetrics comparing paper quality or impact to person intelligence or personality,Personalizing papers using Altmetrics: comparing paper ‘Quality’ or ‘Impact’ to person ‘Intelligence’ or ‘Personality’,scientometrics,"personality , personality , games , personality , correlation , media , funding , digital media , scientometrics , artificial intelligence , artificial intelligence",2017,English,10.1007/s11192-017-2246-9
287,lisa,"xuan zhen liu, hui fang",what we can learn from tweets linking to research papers,What we can learn from tweets linking to research papers,scientometrics,"social networks , scoring , social networks , media , scientific papers , evaluation , digital media , electronic publishing , sentiment analysis",2017,English,10.1007/s11192-017-2279-0
288,lisa,andrea m mlis ketchum,the research life cycle and the health sciences librarian responding to change in scholarly communication,The research life cycle and the health sciences librarian: responding to change in scholarly communication,journal of the medical library association,"studies , librarians , collaboration , academic libraries , strategic planning , medical research , bibliographic data bases , bibliometrics , public access , internet , clinical trials , digital asset management , copyright , funding , researchers , government grants , health sciences , open access publishing , digitization , informetrics , liaison work , medical libraries , scholarly communication , user services , united states--us , california",2017,English,10.5195/jmla.2017.110
289,lisa,"lilian phd hoffecker, dana mls abbey",from english to chinese japanese and russian extending research visibility with language translations of a conference slide presentation,"From English to Chinese, Japanese, and Russian: extending research visibility with language translations of a conference slide presentation",journal of the medical library association,"social networks , web sites , librarians , research , academic libraries , anglophones , audiences , presentations , bibliometrics , translations , conferences , researchers , russian language , informetrics , library associations , medical libraries , open access , united states--us , colorado",2017,English,10.5195/jmla.2017.106
290,lisa,"heather moulaison sandy, edward m corrado, brandi b ivester",personal digital archiving an analysis of urls in the edu domain,Personal digital archiving: an analysis of URLs in the .edu domain,library hi tech,"archives & records , academic libraries , librarians , studies , social networks , search engines , researchers , work life balance , information professionals , research data management , research guides , information sources , library associations , urls , libraries , scientific papers , websites , search engines , locators , data management , universities , archiving , format , information management , missouri , united states--us",2017,English,10.1108/lht-11-2016-0120
291,lisa,bonnie l fong,an exploration of changing dissertation requirements and library services to support them,An Exploration of Changing Dissertation Requirements and Library Services to Support Them,portal,"colleges & universities , graduate studies , academic libraries , dissertations & theses , websites , english , social sciences , politics , questionnaires , united states--us",2017,English,10.1353/pla.2017.0008
293,lisa,"jisun an, david j crandall, roman fedorov, casey fiesler, fabio giglietto, bahareh heravi, jessica pater, konstantinos pelechrinis, daniele quercia, katrin weller, arkaitz zubiaga",reports of the workshops held at the 2016 international aaai conference on web and social media,Reports of the Workshops Held at the 2016 International AAAI Conference on Web and Social Media,ai magazine,"social networks , workshops , ethics , crowdsourcing , newsrooms , social networks , demographics , webs , environmental monitoring , media , workshops , ecological monitoring , digital media , italy , georgia",2016,English,
295,lisa,"lutz bornmann, robin haunschild",overlay maps based on mendeley data the use of altmetrics for readership networks,Overlay maps based on Mendeley data: The use of altmetrics for readership networks,journal of the association for information science and technology,"studies , readership , visualization , scientometrics , networks , digital computers , digital data , audience , reading , maps",2016,English,
296,lisa,sasekea harris,trends and issues in jamaican academic libraries 2010 2016,Trends and issues in Jamaican academic libraries 2010-2016,new library world,"academic libraries , librarians , science , trends , library associations , united states--us , europe , jamaica",2016,English,10.1108/nlw-08-2016-0055
297,lisa,"nadine desrochers, audrey laplante, martin kim, anabel quan-haase, louise spiteri",illusions of a bond tagging cultural products across online platforms,Illusions of a “Bond”: tagging cultural products across online platforms,journal of documentation,"research , user-generated content , libraries , social networks , user behavior , library and information science , user generated content , researchers , illusions , norms , humanities , platforms , book reviews , library catalogs , social sciences , marking , books , music , tags , social networks , tagging , casinos , catalogs , canada , fleming, ian",2016,English,10.1108/jd-09-2015-0110
299,lisa,blanca san jose montano,using the journal bmj case reports to promote the publication of clinical case reports,Using the journal BMJ Case Reports to promote the publication of clinical case reports,journal of the medical library association,"librarians , hospitals , departments , publishing , manuscripts , clinical medicine , quality , journals , impact factors , library associations , medical libraries , spain",2016,English,10.3163/1536-5050.104.4.015
300,lisa,nettie lagace,niso releases recommended practice covering outputs of its multiyear project in alternative assessment metrics,NISO Releases Recommended Practice Covering Outputs of Its Multiyear Project in Alternative Assessment Metrics,serials review,"citation analysis , publication output",2016,English,10.1080/00987913.2016.1246343
301,lisa,"kurt blythe, jessica brangiel, erin finnerty, stephanie larrison, angela rathmel, breanna webb, tiffanie wick",reports of conferences institutes and seminars,"Reports of Conferences, Institutes, and Seminars",serials review,"scholarly communication , journals , bibliometrics",2016,English,10.1080/00987913.2016.1242979
302,lisa,"transito ferreras-fernandez, francisco garcia-penalvo, jose a merlo-vega, helena martin-rodero",providing open access to phd theses visibility and citation benefits,Providing open access to PhD theses: visibility and citation benefits,program,"academic libraries , studies , scholars , dissertations & theses , library and information science , scientific papers , visibility , citation analysis , repositories , empirical analysis , theses , spain , united kingdom--uk",2016,English,10.1108/prog-04-2016-0039
303,lisa,"christine e shaw, andrea l szwajcer",publication rate of presentation abstracts presented at the canadian health libraries association chla absc annual meetings from 2004 2009,Publication rate of presentation abstracts presented at the Canadian Health Libraries Association (CHLA/ABSC) annual meetings from 2004-2009,performance measurement and metrics,"studies , academic libraries , librarians , humanities , meetings , books , library science , publications , polls & surveys , presentations , medical research , bibliometrics , publishing , conferences , researchers , health sciences , informetrics , library associations , medical libraries , scientometrics , libraries , health , canada",2016,English,10.1108/pmm-07-2016-0034
304,lisa,sasekea harris,distinctive services in academic librarianship,Distinctive services in academic librarianship,new library world,"academic libraries , college campuses , university colleges , learning commons , literature reviews , united states--us , jamaica",2016,English,10.1108/nlw-05-2016-0036
305,lisa,omwoyo bosire onyancha,open research data in sub saharan africa a bibliometric study using the data citation index,Open Research Data in Sub-Saharan Africa: A Bibliometric Study Using the Data Citation Index,publishing research quarterly,"data analysis , citation analysis , scholarly publishing , open access publishing , bibliometrics , genetics , biology , statistical analysis , sub-saharan africa",2016,English,10.1007/s12109-016-9463-6
306,lisa,"gali halevi, barnaby nicolas, judit bar-ilan",the complexity of measuring the impact of books,The Complexity of Measuring the Impact of Books,publishing research quarterly,"publishing industry , measurement , books , audience , united states--us , new york",2016,English,10.1007/s12109-016-9464-5
307,lisa,"mike thelwall, paul wilson",mendeley readership altmetrics for medical articles an analysis of 45 fields,Mendeley readership altmetrics for medical articles: An analysis of 45 fields,journal of the association for information science and technology,"studies , readership , medical research , benchmarks , scholarly publishing , citation analysis , medical research , readers , power law , correlation , electric power distribution , law , audience , reading",2016,English,
309,lisa,jenny teresita guerra gonzalez,analisis de las revistas cientificas digitales del indice de revistas mexicanas de investigacion cientifica y tecnologica cumplimiento de criterios institucionales y adopcion de parametros editoriales digitales,Análisis de las revistas científicas digitales del Índice de Revistas Mexicanas de Investigación Científica y Tecnológica: cumplimiento de criterios institucionales y adopción de parámetros editoriales digitales,revista general de informacion y documentacion,"technology adoption , electronic publishing , compliance , indexes , journals , buttons , social networks , downloading , parameters , hypertext markup language , criteria , mexico",2016,Spanish,10.5209/rgid.54717
310,lisa,joseph w. greene,web robot detection in scholarly open access institutional repositories,Web robot detection in scholarly Open Access institutional repositories,library hi tech,"studies , academic libraries , use statistics , archives & records , research methodology , robots , search engines , labeling , internet resources , institutional repositories , open access",2016,English,10.1108/lht-04-2016-0048
313,lisa,"shri ram, nitin paliwal",management of university research publication a case study of juit publication database jpubdb,Management of University Research Publication: A Case Study of JUIT Publication Database (JPubDB),desidoc journal of library information technology,"bibliometrics , data bases , academic publications , web analytics , case studies , performance measurement , universities , databases , scientific papers , documents , market research , bibliometrics , patiala india , india",2016,English,10.14429/djlit.36.4.9912
314,lisa,carla basili,academic blogging consequences for open science a first insight into their potential impact,Academic blogging consequences for Open Science: a first insight into their potential impact *,the grey journal,"social networks , scholarly communication , webometrics , blogs",2016,English,
315,lisa,donald t hawkins,almetrics and books bookmetrix and other implementations,Almetrics and Books: Bookmetrix and Other Implementations,against the grain,"books , informetrics",2016,English,
316,lisa,"andy tattersall, maria j grant",big data what is it and why it matters,Big Data - What is it and why it matters,health information and libraries journal,"libraries , big data , data management , libraries",2016,English,10.1111/hir.12147
317,lisa,"lutz bornmann, robin haunschild",to what extent does the leiden manifesto also apply to altmetrics a discussion of the manifesto against the background of research into altmetrics,To what extent does the Leiden manifesto also apply to altmetrics? A discussion of the manifesto against the background of research into altmetrics,online information review,"social networks , research , science , studies , publications , bibliometrics , principles , peer review , peers , citation indexes , informetrics , scientometrics , germany , planck, max",2016,English,10.1108/oir-09-2015-0314
320,lisa,"ehsan mohammadi, mike thelwall, kayvan kousha",can mendeley bookmarks reflect readership a survey of user motivations,Can Mendeley bookmarks reflect readership? A survey of user motivations,journal of the association for information science and technology,"user behavior , studies , readership , correlation analysis , electronic publishing , libraries , citation analysis , readers , scientific papers , documents , polls & surveys , educational activities , audience , respondents",2016,English,
321,lisa,jela steinerova,information challenges of digital science conceptual frameworks,Information Challenges of Digital Science: Conceptual Frameworks,journal of library information science,"information seeking behavior , researchers , big data , user needs , scholarly communication , sustainability , information science",2016,English,
322,lisa,terry henner,from the literature,From the Literature,medical reference services quarterly,"primary care , nonfiction , access to information , user needs , bibliometrics , scholarly publishing , books",2016,English,10.1080/02763869.2016.1152151
323,lisa,"mike thelwall, kayvan kousha",figshare a universal repository for academic resource sharing,Figshare: a universal repository for academic resource sharing?,online information review,"software , research , archives & records , studies , confidence intervals , collaboration , information sharing , funding , digital object identifier , scholars , internet resources , researchers , datasets , scholarly communication , websites , united kingdom--uk",2016,English,10.1108/oir-06-2015-0190
325,lisa,"mike thelwall, nabeil maflahi",guideline references and academic citations as evidence of the clinical value of health research,Guideline references and academic citations as evidence of the clinical value of health research,journal of the association for information science and technology,"studies , informetrics , medical research , citation analysis , readership , articles , guidelines , medical personnel , health , medical research , audience , united kingdom--uk",2016,English,
326,lisa,"christian pieter hoffmann, christoph lutz, miriam meckel",a relational altmetric network centrality on researchgate as an indicator of scientific impact,A relational altmetric? Network centrality on ResearchGate as an indicator of scientific impact,journal of the association for information science and technology,"studies , impact analysis , social network analysis , scholarly publishing , social networks , researchers , social networks , network analysis , digital media , eigenvectors , academic discourse",2016,English,
328,lisa,"gerald beasley, trish rosseel",leaning into sustainability at university of alberta libraries,Leaning into sustainability at University of Alberta Libraries,library management,"academic libraries , colleges & universities , lean manufacturing , sustainability , canada",2016,English,10.1108/lm-04-2016-0023
329,lisa,"charlene sorensen, rachel sarjeant-jenkins",sustainable growth with sustainable resources,Sustainable growth with sustainable resources,library management,"academic libraries , librarians , higher education , research , teaching , learning , planning , international finance , student retention , trends , college campuses , collaboration , leadership , researchers , scholarly communication , user services , canada",2016,English,10.1108/lm-04-2016-0022
330,lisa,alka bansal,creating awareness of publications through marketing case study of desidoc journal of library amp amp information technology djlit,Creating Awareness of Publications through Marketing: Case Study of DESIDOC Journal of Library &amp;amp; Information Technology (DJLIT),desidoc journal of library information technology,"library and information science , feedback , journals , product development , marketing , libraries , product development , customer satisfaction , marketing , feedback , customer services",2016,English,10.14429/djlit.36.2.9714
331,lisa,elsa anderson,print to electronic the library perspective,Print to Electronic: The Library Perspective,publishing research quarterly,"metadata , publishing industry , libraries , libraries , computer software , baltimore maryland , united states--us , new york",2016,English,10.1007/s12109-015-9440-5
332,lisa,"angel borrego, lluis anglada",faculty information behaviour in the electronic environment,Faculty information behaviour in the electronic environment,new library world,"academic libraries , studies , scholars , research , bibliographic data bases , bibliometrics , reading , internet , search engines , response rates , questionnaires , researchers , open access publishing , journals , discovery tools , information seeking behavior , monographs , scholarly communication , united kingdom--uk , spain , united states--us",2016,English,10.1108/nlw-11-2015-0089
333,lisa,"rishabh shrivastava, preeti mahajan",relationship between citation counts and mendeley readership metrics,Relationship between citation counts and Mendeley readership metrics,new library world,"studies , social networks , web sites , citation indexes , india",2016,English,10.1108/nlw-09-2015-0064
334,lisa,"lauren b phd collister, timothy s msis dellyannides",altmerics documenting the story of research,Altmerics: Documenting the Story of Research,against the grain,"informetrics , scholarly communication",2016,English,
335,lisa,"michelle swab, kristen romme",scholarly sharing via twitter icanhazpdf requests for health sciences literature,Scholarly Sharing via Twitter: #icanhazpdf Requests for Health Sciences Literature,the journal of the canadian health libraries association journal de lassociation des bibliotheques de la sante du canada,"research , digital object identifier , web sites , journals , books , immunology , social networks , copyright , librarians , researchers , licensing , licenses , library resources , health sciences , access to materials , ireland , united states--us , canada , united kingdom--uk",2016,English,10.5596/c16-009
336,lisa,"julio alonso-arevalo, marta vazquez vazquez",altmetrics y alfabetizacion cientifica altmetrics and scientific literacy,Altmetrics y alfabetización científica / Altmetrics and scientific literacy,bibliotecas anales de investigacion,"social networks , web 2.0 , bibliometrics , informetrics",2016,Spanish,
337,lisa,"mike thelwall, kayvan kousha, adam dinsmore, kevin dolby",alternative metric indicators for funding scheme evaluations,Alternative metric indicators for funding scheme evaluations,aslib journal of information management,"added value, bibliometrics, business metrics, confidence intervals, empirical analysis, funding, funding, independent sample, indicators, informetrics, library science, performance evaluation, research, researchers, studies, webometrics",2016,English,10.1108/ajim-09-2015-0146
338,lisa,jose luis ortega,to be or not to be on twitter and its relationship with the tweeting and citation of research papers,"To be or not to be on Twitter, and its relationship with the tweeting and citation of research papers",scientometrics,"social networks , citation analysis , data processing , followers , analytics , scientific papers",2016,English,10.1007/s11192-016-2113-0
339,lisa,"mojisola erdt, aarthy nagarajan, joanna sin sei-ching, yin-leng theng",altmetrics an analysis of the state of the art in measuring research impact on social media,Altmetrics: an analysis of the state-of-the-art in measuring research impact on social media,scientometrics,"social networks , social networks , informetrics , media , reviews , data sources , digital media , correlation analysis , literature reviews",2016,English,10.1007/s11192-016-2077-0
340,lisa,"xianwen wang, zhichao fang, xinhui guo",tracking the digital footprints to scholarly articles from social media,Tracking the digital footprints to scholarly articles from social media,scientometrics,"social networks , social networks , media , decay rate , digital media",2016,English,10.1007/s11192-016-2086-z
341,lisa,"mike thelwall, kayvan kousha",are citations from clinical trials evidence of higher impact research an analysis of clinicaltrials gov,Are citations from clinical trials evidence of higher impact research? An analysis of ClinicalTrials.gov,scientometrics,"research , clinical trials , clinical trials , impact analysis , journals , warning , medical research , medical research , hypotheses",2016,English,10.1007/s11192-016-2112-1
342,lisa,"xianwen wang, zhichao fang, xiaoling sun",usage patterns of scholarly articles on web of science a study on web of science usage count,Usage patterns of scholarly articles on Web of Science: a study on Web of Science usage count,scientometrics,"use statistics , data processing , libraries , science , studies",2016,English,10.1007/s11192-016-2093-0
343,lisa,ronald snijder,revisiting an open access monograph experiment measuring citations and tweets 5 amp xa0 years later,Revisiting an open access monograph experiment: measuring citations and tweets 5&amp;#xa0;years later,scientometrics,"monographs , language , open access , social networks , citation analysis",2016,English,10.1007/s11192-016-2160-6
344,lisa,"saeideh ebrahimy, jafar mehrad, fatemeh setareh, massoud hosseinchari",path analysis of the relationship between visibility and citation the mediating roles of save discussion and recommendation metrics,"Path analysis of the relationship between visibility and citation: the mediating roles of save, discussion, and recommendation metrics",scientometrics,"visibility , social networks , visibility , citation analysis , citation analysis , social organization , correlation analysis , social networks , informetrics , social interactions , sampling methods , scientific papers , correlation analysis",2016,English,10.1007/s11192-016-2130-z
345,lisa,"amalia mas-bleda, mike thelwall",can alternative indicators overcome language biases in citation counts a comparison of spanish and uk research,Can alternative indicators overcome language biases in citation counts? A comparison of Spanish and UK research,scientometrics,"webometrics , bibliometrics , citation indexes , lists , indicators , social networks , indicators , citation analysis , citation analysis , informetrics , readers , internet , digital media , computer assisted instruction--cai , distance learning , spain , united kingdom--uk",2016,English,10.1007/s11192-016-2118-8
346,lisa,"lutz bornmann, robin haunschild, werner marx",policy documents as sources for measuring societal impact how often is climate change research mentioned in policy related documents,Policy documents as sources for measuring societal impact: how often is climate change research mentioned in policy-related documents?,scientometrics,"climate change , climate change , climate change , climate , systems analysis , informetrics , climate change , geography , documents , geography , datasets , social impact , academic publications",2016,English,10.1007/s11192-016-2115-y
347,lisa,"ronaldo ferreira de araujo, ariadne chloe mary furnival",comunicacao cientifica e atencao online em busca de colegios virtuais que sustentam metricas alternativas,COMUNICAÇÃO CIENTÍFICA E ATENÇÃO ONLINE: EM BUSCA DE COLÉGIOS VIRTUAIS QUE SUSTENTAM MÉTRICAS ALTERNATIVAS COMUNICACIÓN CIENTÍFICA Y ATENCIÓN EN LÍNEA: EN BÚSQUEDA DE COLEGIOS VIRTUALES QUE APOYAN LAS ALTMÉTRICAS,informacao informacao,social networks,2016,English,
348,lisa,"tara malone, susan burke",academic librarians knowledge of bibliometrics and altmetrics,Academic Librarians' Knowledge of Bibliometrics and Altmetrics,evidence based library and information practice,"bibliometrics , informetrics , school faculty , librarians",2016,English,
349,lisa,"clara tran, selenay aytac",measuring scholarly productivity of long island educational institutions using web of science and scopus as a tool,Measuring Scholarly Productivity of Long Island Educational Institutions: Using Web of Science and Scopus as a Tool,evidence based library and information practice,"publication output , productivity , scholarly communication",2016,English,
350,lisa,dominique daniel,faculty still rely on library resources and services for their research,Faculty Still Rely on Library Resources and Services for their Research,evidence based library and information practice,"scholarly communication , user services , information literacy , library catalogs , academic libraries , bibliographic data bases , information sources , information seeking behavior , college faculty , library resources , spain",2016,English,
351,lisa,"kathleen reed, dana mcfarland, rosie croft",laying the groundwork for a new library service scholar practitioner amp amp graduate student attitudes toward altmetrics and the curation of online profiles,Laying the Groundwork for a New Library Service: Scholar-Practitioner &amp;amp; Graduate Student Attitudes Toward Altmetrics and the Curation of Online Profiles,evidence based library and information practice,"informetrics , scholars , librarians",2016,English,
352,lisa,virginia wilson,research methods altmetrics,Research Methods: Altmetrics,evidence based library and information practice,"seminars , information literacy , librarians , college students , curricula , canada",2016,English,
